{
 "record_type": "SupersessionRecord",
 "record_id": "pgw:l:00000000000001000010000000000000",
 "created_at": "2026-08-04T06:02:00.000Z",
 "responsible_role": "trusted-lifecycle-authority",
 "registry_snapshot_reference": {
  "registry_protocol_id": "project-gateway.registry",
  "registry_snapshot_format_version": "1.0",
  "registry_snapshot_id": "pgw:g:3fb51a11f2b23ba8c171326cbba7eb64",
  "registry_snapshot_digest": "sha-256:613112612ee7803db00c6e51826b3a63ee6ce6732b17c9b09ae8aff00db47c05",
  "protocol_compatibility": {
   "mode": "exact-release",
   "artifact_protocol_id": "project-gateway.artifact",
   "artifact_protocol_version": "1.0"
  }
 },
 "prior": {
  "subject_type": "result-publication",
  "record_id": "pgw:l:0000000000000100000c000000000000"
 },
 "successor": {
  "subject_type": "result-publication",
  "record_id": "pgw:l:0000000000000100000e000000000000"
 },
 "scope": "ordinary-review",
 "reason_code": "receipt-correlation"
}
